{
  "abstainReason": "PROVIDER_DISABLED",
  "approvalPacketHash": null,
  "articleMetadataStored": false,
  "artifactHash": "2222222222222222222222222222222222222222222222222222222222222222",
  "attribution": {
    "citation": "The GDELT Project",
    "projectUrl": "https://www.gdeltproject.org/",
    "provider": "GDELT",
    "termsUrl": "https://www.gdeltproject.org/about.html"
  },
  "availableAt": "2026-07-31T00:00:02Z",
  "collectionMode": "OFFLINE_FIXTURE",
  "decisionAuthority": "NONE",
  "modes": [
    "TIMELINE_TONE",
    "TIMELINE_VOL_RAW"
  ],
  "observationId": "gdelt_obs_semiconductor_20260731",
  "observedAt": "2026-07-31T00:00:00Z",
  "physicalAttemptCount": 0,
  "queryRegistryId": "global_semiconductor_stress_v1",
  "rawProviderDataStored": false,
  "receivedAt": "2026-07-31T00:00:01Z",
  "schemaVersion": "1",
  "sourceCompleteness": "UNAVAILABLE",
  "status": "ABSTAIN",
  "windowEnd": "2026-07-31T00:00:00Z",
  "windowStart": "2026-07-30T00:00:00Z"
}
